id,text
astro_082,"Optical time-domain surveys detect superflares on 500 solar-type stars with energies exceeding 10^34 erg. The flare frequency distribution extrapolated to solar luminosity suggests the Sun may produce similar superflares once per 3000 years, with implications for space weather and exoplanet habitability."
astro_083,"We analyze the mass-radius relation for exoplanets with measured densities. The transition from rocky to volatile-rich compositions occurs at 1.6 Earth radii, defining a radius valley that separates super-Earths from sub-Neptunes and reflects atmospheric loss through photoevaporation."
astro_084,"Submillimeter observations of Class 0 protostars with ALMA resolve accretion disk structures at 10 AU scales. The presence of Keplerian rotation profiles and spiral arm features indicates gravitational instability operates during the earliest stages of disk evolution when most stellar mass is assembled."
astro_085,"We measure the escape fraction of ionizing photons from star-forming galaxies at z = 3 using narrow-band imaging. The average escape fraction of 5% among Lyman-alpha emitters is sufficient to maintain cosmic reionization if extrapolated to the faint galaxy population."
astro_086,"Analysis of transit timing variations in the Kepler-80 system reveals a chain of five planets in mean-motion resonance. The resonant configuration requires convergent migration through a dissipating gas disk, providing observational support for planet formation models involving orbital evolution."
astro_087,"We present dynamical models of the Andromeda galaxy's stellar halo using proper motion measurements from HST. The halo exhibits net rotation of 50 km/s consistent with accretion of the Giant Stellar Stream progenitor on a prograde orbit approximately 2 billion years ago."
astro_088,"Radio VLBI observations of the water maser emission in NGC 4258 achieve microarcsecond astrometry of the nuclear disk. The measured geometric distance of 7.58 ± 0.11 Mpc provides an independent anchor for the extragalactic distance scale and reduces Hubble constant systematic errors."
astro_089,"We investigate the chemical compositions of stars in the Gaia-Enceladus-Sausage merger remnant. The alpha-element abundances and age distribution indicate this dwarf galaxy was accreted 10 billion years ago with a stellar mass of 5 × 10^8 solar masses, fundamentally reshaping the Milky Way's inner halo."
astro_090,"Spectroscopic observations of the ultra-cool dwarf TRAPPIST-1 constrain the host star's properties for exoplanet characterization. The measured metallicity of [Fe/H] = +0.04, effective temperature of 2566 K, and radius of 0.121 solar radii refine planetary mass and equilibrium temperature estimates."
astro_091,"We detect gamma-ray emission from nova V906 Carinae using Fermi-LAT observations coincident with optical maximum. The high-energy flux requires particle acceleration to GeV energies at the shock between fast and slow components of the nova ejecta, establishing novae as gamma-ray transient sources."
astro_092,"Analysis of the orbital decay of the hot Jupiter WASP-12b confirms tidal dissipation in the host star. The measured period derivative of 29 ms/yr implies a remaining inspiral timescale of 3 million years and constrains the stellar tidal quality factor to Q' = 2 × 10^5."
astro_093,"We present rest-frame UV morphologies of Lyman-break galaxies at z = 6-8 from JWST imaging. The compact sizes of 300-500 pc and high stellar surface densities suggest these systems are the progenitors of present-day massive elliptical galaxy cores formed through dissipative collapse."
astro_094,"Magnetohydrodynamic simulations of accretion onto young stars including large-scale magnetic fields show episodic accretion driven by magnetic Rayleigh-Taylor instabilities. The resulting luminosity bursts with amplitudes of 1-2 magnitudes on year timescales match observed FU Orionis outburst properties."
astro_095,"We measure the binary fraction of brown dwarfs in the solar neighborhood using high-resolution imaging. The companion frequency of 15% for separations 1-100 AU is significantly lower than solar-type stars, suggesting brown dwarf binaries form through disk fragmentation rather than turbulent core fragmentation."
astro_096,"Analysis of the diffuse gamma-ray background with Fermi-LAT constrains the contribution from unresolved blazars. The residual isotropic emission after subtracting known source populations may indicate particle dark matter annihilation, though systematic uncertainties in the galactic diffuse foreground model remain significant."
astro_097,"We investigate the period-luminosity relation for Cepheid variables in galaxies hosting Type Ia supernovae. Metallicity-dependent calibration reduces scatter in the Hubble diagram and yields H0 = 73.0 ± 1.0 km/s/Mpc, maintaining tension with CMB-derived values at 5-sigma significance."
astro_098,"Spectral analysis of thermonuclear X-ray bursts from the neutron star 4U 1820-30 detects gravitationally redshifted absorption lines. The measured redshift of z = 0.35 constrains the neutron star mass-to-radius ratio and favors equations of state with maximum masses above 2.3 solar masses."
astro_099,"We present the discovery of coherent radio emission from an ultracool dwarf-white dwarf binary. The circularly polarized pulses at the orbital period indicate magnetic interaction between the brown dwarf magnetosphere and the white dwarf's radiation field, analogous to Jupiter-Io coupling."
astro_100,"Cosmological hydrodynamic simulations of the circumgalactic medium predict bimodal metallicity distributions at z = 2. The metal-poor component traces cold accretion streams feeding galaxy growth while the enriched phase arises from galactic outflows, with observational signatures detectable through quasar absorption spectroscopy."
