id,text
astro_001,"We present high-resolution spectroscopic observations of red giant branch stars in the galactic bulge. Our analysis reveals a bimodal metallicity distribution with peaks at [Fe/H] = -0.3 and +0.3 dex. The metal-rich population shows enhanced alpha-element abundances consistent with rapid chemical enrichment, while the metal-poor component exhibits signatures of a more extended star formation history."
astro_002,"Using data from the Transiting Exoplanet Survey Satellite, we report the discovery of a super-Earth orbiting within the habitable zone of the M-dwarf TOI-7834. The planet has a radius of 1.4 Earth radii and an orbital period of 12.3 days. Transmission spectroscopy with JWST reveals tentative water vapor absorption features in the planetary atmosphere."
astro_003,"We investigate the properties of dark matter halos in cosmological N-body simulations with varying dark matter particle masses. Our results show that halo concentration parameters decrease systematically with increasing particle mass, suggesting that warm dark matter models predict significantly different small-scale structure compared to cold dark matter scenarios."
astro_004,"Multi-wavelength observations of the gamma-ray burst GRB 240315A reveal an unusually long-lived X-ray afterglow extending beyond 100 days post-burst. The temporal and spectral evolution is consistent with energy injection from a newly-formed magnetar central engine rather than the standard forward shock model."
astro_005,"We present the first direct imaging detection of a Jupiter-mass exoplanet orbiting a white dwarf at 2.5 AU separation. The system provides unique constraints on planetary survival during post-main-sequence stellar evolution and suggests that giant planets at intermediate orbital distances can survive the host star's asymptotic giant branch phase."
astro_006,"Analysis of Gaia DR3 proper motions reveals a previously unknown stellar stream in the galactic halo with a metallicity of [Fe/H] = -2.1. The stream's orbital properties indicate it originated from a disrupted dwarf galaxy accreted approximately 8 billion years ago, contributing to our understanding of the Milky Way's hierarchical assembly."
astro_007,"We report precision radial velocity measurements of the millisecond pulsar PSR J1012+5307 using pulsar timing arrays. The data constrain the pulsar's orbital parameters to unprecedented accuracy and provide an independent measurement of the neutron star mass consistent with a stiff equation of state for dense nuclear matter."
astro_008,"Atacama Large Millimeter Array observations of the protoplanetary disk around HD 163296 reveal multiple ring and gap structures at 10, 48, and 86 AU. Hydrodynamical simulations suggest these features are carved by three embedded planets with masses of 0.5, 1.0, and 2.0 Jupiter masses undergoing Type II migration."
astro_009,"We analyze the spectral energy distribution of the blazar 3C 279 during a major gamma-ray flare. The broadband emission from radio to TeV energies is well-described by a two-zone leptonic model with relativistic jet Doppler factors exceeding 40, among the highest inferred for any active galactic nucleus."
astro_010,"Cosmological constraints from the combination of Planck CMB temperature and polarization data with baryon acoustic oscillation measurements yield a Hubble constant of H0 = 67.4 ± 0.5 km/s/Mpc. This value remains in 4.5-sigma tension with local distance ladder measurements, strengthening evidence for new physics beyond the standard cosmological model."
astro_011,"We present spectropolarimetric observations of the magnetic chemically peculiar star HD 94660 revealing a complex surface magnetic field geometry. Zeeman Doppler imaging reconstructs a field topology dominated by a decentered dipole with additional quadrupolar and octupolar components, with a polar field strength of 3.2 kG."
astro_012,"Deep Chandra X-ray observations of the Coma galaxy cluster reveal temperature substructure indicative of ongoing merger activity. The observed cold fronts and shock features are consistent with a recent off-axis collision with a smaller cluster approximately 1.5 Gyr ago, as confirmed by comparison with hydrodynamical simulations."
astro_013,"We investigate the epoch of reionization using Lyman-alpha emitter surveys at redshifts z = 6.5-7.5. The observed decline in Lyman-alpha luminosity function implies a volume-averaged neutral hydrogen fraction of approximately 50% at z = 7, consistent with an extended reionization process driven primarily by low-mass galaxies."
astro_014,"Gravitational wave observations from LIGO-Virgo-KAGRA of the binary black hole merger GW230914 reveal component masses of 45 and 32 solar masses. The high primary mass challenges standard stellar evolution models and may indicate a hierarchical merger origin in dense stellar environments such as globular clusters."
astro_015,"We report the detection of phosphine in the atmosphere of Venus using submillimeter spectroscopy. The observed abundance of 20 ppb at cloud-deck altitudes cannot be explained by known abiotic chemistry and represents a potential biosignature requiring verification through future in-situ atmospheric missions."
astro_016,"Far-ultraviolet spectroscopy of the white dwarf GD 394 reveals photospheric absorption from heavy elements including iron, nickel, and silicon. The derived accretion rate of 10^9 g/s is consistent with ongoing disruption of a rocky asteroid, providing evidence for planetary material surviving into the white dwarf cooling phase."
astro_017,"We analyze the cosmic microwave background B-mode polarization signal from the BICEP/Keck array. The updated constraints on the tensor-to-scalar ratio yield r < 0.036 at 95% confidence, placing stringent limits on the energy scale of cosmic inflation and disfavoring several large-field inflationary models."
astro_018,"Integral field spectroscopy of the Seyfert 2 galaxy NGC 5506 maps the narrow-line region kinematics with 50 pc resolution. We detect a biconical outflow extending 500 pc from the nucleus with velocities exceeding 800 km/s, carrying sufficient momentum to regulate star formation in the host galaxy."
astro_019,"We present astroseismic analysis of solar-like oscillations in 500 red giant stars observed by Kepler. The measured period spacings distinguish hydrogen-shell burning from helium-core burning giants, enabling precise determination of stellar evolutionary states and masses to better than 5% accuracy."
astro_020,"High-cadence photometry from TESS reveals quasi-periodic oscillations in the X-ray binary Cyg X-1 with periods ranging from 50 to 200 milliseconds. The oscillation properties correlate with spectral state, suggesting a connection to instabilities in the inner accretion disk near the black hole event horizon."
astro_021,"We constrain the axion dark matter parameter space using observations of the magnetic white dwarf RE J0317-853. The non-detection of anomalous cooling rates excludes axion-electron couplings above 10^-13 for axion masses between 1 meV and 1 eV, complementing laboratory search experiments."
astro_022,"Submillimeter polarimetry of the Orion molecular cloud complex reveals highly ordered magnetic field structures aligned with dense filaments. The field morphology is consistent with magnetically-regulated gravitational collapse, supporting theoretical models where magnetic fields play a dominant role in controlling the star formation rate."
astro_023,"We report the discovery of a tidal disruption event in the nucleus of the dwarf galaxy SDSS J152120.07+140410.5. The event luminosity and timescale imply a central black hole mass of approximately 10^5 solar masses, providing rare observational evidence for intermediate-mass black holes in low-mass galaxies."
astro_024,"Analysis of absorption line profiles in the spectrum of the hot Jupiter WASP-76b reveals asymmetric iron signatures consistent with condensation on the planetary nightside. Our 3D atmospheric circulation models reproduce the observed day-night chemical gradients, demonstrating iron rain as a significant atmospheric process."
astro_025,"We present weak gravitational lensing measurements around 10,000 galaxy clusters from the Dark Energy Survey. The stacked shear profiles constrain the average cluster mass-concentration relation, revealing a 15% lower normalization than predicted by dark matter-only simulations, possibly indicating baryonic feedback effects."
astro_026,"Radio observations of the supernova remnant Cassiopeia A at 10 GHz detect linear polarization fractions exceeding 70% in localized regions. The polarization morphology traces the remnant's magnetic field structure and implies significant field amplification at the forward shock through plasma instabilities."
astro_027,"We investigate star formation quenching mechanisms using spatially-resolved spectroscopy of 500 post-starburst galaxies at z = 0.5-1.0. The radial gradients in stellar age indicate outside-in quenching proceeding on timescales of 500 Myr, consistent with strangulation following satellite accretion rather than rapid AGN feedback."
astro_028,"Timing observations of the binary pulsar PSR J0737-3039 over 15 years measure the orbital period derivative to 0.01% precision. The value agrees with general relativistic predictions for gravitational wave emission to 0.1%, providing one of the most stringent tests of Einstein's theory in the strong-field regime."
astro_029,"We analyze the chemical abundances of extremely metal-poor stars in the Milky Way halo. The observed pattern of neutron-capture elements in stars with [Fe/H] < -3 requires contributions from both rapid neutron capture in neutron star mergers and a second r-process site, possibly magnetorotational supernovae."
astro_030,"Spectroscopic monitoring of the symbiotic star RS Ophiuchi following its 2021 nova eruption reveals evidence for gamma-ray production in the shock between the nova ejecta and the red giant wind. The observed spectral evolution constrains particle acceleration efficiency at the shock to approximately 10%."
astro_031,"We present three-dimensional maps of the local interstellar medium within 300 pc derived from Gaia parallaxes and extinction measurements. The data reveal the Local Bubble as an irregular cavity with density walls at varying distances, shaped by multiple supernova explosions over the past 15 million years."
astro_032,"Deep HST imaging of the ultra-faint dwarf galaxy Tucana III measures a half-light radius of only 44 pc and a stellar mass of 800 solar masses. The extremely low luminosity and high mass-to-light ratio of 1400 imply dark matter domination even at these small scales."
astro_033,"We detect circularly polarized radio emission from the brown dwarf 2MASS J10475385+2124234 at 8 GHz. The 100% circular polarization and coherent pulse morphology indicate electron cyclotron maser emission from auroral current systems, analogous to planetary magnetospheres rather than stellar coronae."
astro_034,"Analysis of the kilonova AT2017gfo associated with the neutron star merger GW170817 constrains the r-process nucleosynthesis yields. The observed infrared excess requires production of at least 0.05 solar masses of lanthanide elements, establishing neutron star mergers as a dominant site for heavy element production."
astro_035,"We measure the temperature-luminosity relation for hydrogen-atmosphere white dwarfs using Gaia parallaxes and multi-band photometry. The data reveal a 3% systematic offset from theoretical cooling models, suggesting revisions to atmospheric opacity calculations or the white dwarf mass-radius relation are needed."
astro_036,"High-resolution imaging of comet 67P/Churyumov-Gerasimenko with Rosetta reveals surface morphology dominated by layered terrains and circular depressions. The layer orientations indicate the nucleus formed through gentle accretion of smaller cometesimals rather than catastrophic collisions, preserving primordial solar system material."
astro_037,"We report the detection of gravitational waves from a neutron star-black hole merger with a mass ratio of 0.2. The lack of electromagnetic counterpart and the measured tidal deformability parameter constrain the neutron star equation of state and indicate the neutron star was swallowed whole without tidal disruption."
astro_038,"Optical interferometric observations of the red supergiant Betelgeuse reveal asymmetric surface brightness variations consistent with large convective cells. The observed diameter variations of 15% over 400 days correlate with the star's visual brightness changes, explaining the great dimming event of 2019-2020."
astro_039,"We analyze the spatial distribution of ultra-high energy cosmic rays with energies above 40 EeV from the Pierre Auger Observatory. A significant dipole anisotropy is detected pointing away from the galactic center, indicating an extragalactic origin for the highest energy particles."
astro_040,"James Webb Space Telescope observations of the galaxy GN-z11 at redshift z = 10.6 detect nitrogen-enriched gas in the circumgalactic medium. The high nitrogen-to-oxygen ratio suggests pollution from Wolf-Rayet stellar winds and places constraints on the initial mass function of the first stellar generations."
astro_041,"We present models of planetary migration in evolving protoplanetary disks including magnetically-driven disk winds. The wind-driven accretion produces different migration rates than viscous disk models, potentially explaining the observed pile-up of super-Earths at orbital periods near 10 days."
astro_042,"X-ray spectroscopy of the galaxy cluster Abell 2029 with XMM-Newton measures iron abundance gradients in the intracluster medium. The centrally-peaked metallicity profile implies enrichment by Type Ia supernovae in the brightest cluster galaxy over a timescale of several billion years."
astro_043,"We investigate the mass-metallicity relation for galaxies at z = 2-3 using stacked rest-frame optical spectra. The relation shows a 0.3 dex offset to lower metallicities compared to local galaxies at fixed stellar mass, consistent with expectations from gas-regulator models of galaxy chemical evolution."
astro_044,"Radio timing of the pulsar PSR B1937+21 over 30 years constrains the stochastic gravitational wave background from supermassive black hole binaries. The upper limit on the characteristic strain amplitude at 10^-8 Hz disfavors models with high black hole merger rates in the early universe."
astro_045,"We report the discovery of a candidate intermediate-mass black hole in the globular cluster 47 Tucanae using acceleration measurements of millisecond pulsars. The inferred central mass of 2300 solar masses would represent definitive evidence for intermediate-mass black hole formation through runaway stellar collisions."
astro_046,"Spectropolarimetry of the Type Ia supernova SN 2021aefx reveals time-variable polarization signatures indicating asymmetric nickel-56 distribution in the ejecta. The geometry constraints favor off-center delayed detonation explosion models over spherically symmetric scenarios."
astro_047,"We analyze the occurrence rate of planets around binary star systems using Kepler data. Circumbinary planets are detected at approximately half the rate of single-star systems, with a strong preference for orbital periods greater than 50 days due to dynamical stability constraints."
astro_048,"Far-infrared observations of the high-redshift quasar J1342+0928 at z = 7.5 detect dust emission corresponding to a dust mass of 10^8 solar masses. The implied rapid dust formation within 700 million years of the Big Bang challenges standard models of interstellar dust production."
astro_049,"We measure rotation curves for 150 spiral galaxies using spatially-resolved H-alpha velocity fields. The systematic flattening of rotation curves at large radii confirms the presence of extended dark matter halos and constrains the halo concentration-mass relation at the low-mass end."
astro_050,"Analysis of solar oscillation frequencies from the Solar Dynamics Observatory reveals a 0.5% decrease in the sound speed at the base of the convection zone compared to standard solar models. The discrepancy may indicate enhanced convective overshoot mixing or revised solar heavy element abundances."
astro_051,"We present optical spectroscopy of the tidal disruption event AT2019dsg, the first TDE coincident with a high-energy neutrino detection. The presence of broad emission lines and a compact radio source suggests the event launched a relativistic jet capable of accelerating cosmic rays to PeV energies."
astro_052,"High-resolution coronagraphic imaging of the debris disk around Beta Pictoris reveals a secondary disk component inclined by 4 degrees to the main disk. The warp geometry is consistent with gravitational perturbation by the directly-imaged planet Beta Pictoris b, confirming planet-disk interactions."
astro_053,"We analyze the stellar mass function of the Milky Way's globular cluster system. The observed power-law slope at the low-mass end implies significant dynamical evolution through evaporation and tidal stripping, with approximately 75% of the original cluster population now dissolved into the galactic halo."
astro_054,"Infrared spectroscopy of the atmosphere of the warm Neptune GJ 436b reveals an unexpected carbon-to-oxygen ratio exceeding unity. The carbon-rich composition suggests the planet accreted its atmosphere from beyond the water ice line where carbon-bearing molecules dominate over oxygen-rich species."
astro_055,"We constrain modified gravity theories using the observed orbit of the S2 star around Sagittarius A*. The measured periastron precession of 12 arcminutes per orbit agrees with general relativity to 1% precision, excluding scalar-tensor theories with coupling constants above 0.003."
astro_056,"Deep radio continuum observations of the Carina Nebula reveal a population of 47 ultracompact HII regions embedded within the molecular cloud. The ionizing flux requirements indicate these sources harbor massive O-type stars still accreting material, catching star formation in its earliest observable phase."
astro_057,"We present cosmological simulations of galaxy formation including detailed treatment of cosmic ray transport. The cosmic ray pressure support in galactic halos reduces star formation efficiency by a factor of two and launches kiloparsec-scale galactic winds with mass loading factors matching observations."
astro_058,"Analysis of eclipsing binary systems in the Large Magellanic Cloud yields a distance modulus of 18.477 ± 0.026 magnitudes. This geometric distance calibration anchors the cosmic distance ladder and reduces systematic uncertainties in the Hubble constant determination from Cepheid variables."
astro_059,"We investigate the frequency of planetary engulfment during red giant branch evolution using abundance anomalies in stellar spectra. Enhanced refractory-to-volatile element ratios in 8% of first-ascent giants suggest recent accretion of rocky planetary material onto the expanded stellar envelope."
astro_060,"Polarimetric imaging of the supermassive black hole shadow in M87 with the Event Horizon Telescope resolves magnetically-dominated emission at the event horizon scale. The observed polarization pattern constrains the black hole spin to values above 0.5 and implies magnetically arrested disk accretion."
astro_061,"We report the detection of molecular oxygen in the atmosphere of the exoplanet TRAPPIST-1e using JWST transmission spectroscopy. The observed O2 abundance of 1% coupled with the absence of industrial pollutants suggests abiotic photochemical production rather than biological activity."
astro_062,"Analysis of the period distribution of contact binary stars reveals a sharp lower limit at 0.22 days. This period cutoff corresponds to the minimum orbital separation where both components fill their Roche lobes, providing constraints on the physics of common envelope evolution."
astro_063,"We measure the galaxy-galaxy lensing signal around 50,000 luminous red galaxies from the Subaru Hyper Suprime-Cam survey. The stacked shear profiles constrain the galaxy-halo mass relation and reveal satellite distributions extending to 3 times the virial radius."
astro_064,"Spectroscopic follow-up of candidate very metal-poor stars from the Pristine survey identifies a star with [Fe/H] = -6.2, among the most iron-poor objects known. The carbon enhancement and absence of neutron-capture elements indicate enrichment by a single low-energy supernova in the early universe."
astro_065,"We analyze pulsar wind nebula morphologies in 3D magnetohydrodynamic simulations. The jet-torus structures observed in Chandra X-ray images arise naturally from the interaction between a magnetized relativistic pulsar wind and the surrounding supernova ejecta, constraining pulsar obliquity angles."
astro_066,"High-contrast imaging of the young star PDS 70 detects thermal emission from circumplanetary disk material surrounding the embedded protoplanet PDS 70c. The disk radius of 1.2 Jupiter radii implies active satellite formation, providing the first observational evidence for moon formation in progress."
astro_067,"We present dynamical modeling of the nuclear star cluster in the Milky Way combining proper motions and radial velocities for 10,000 stars. The data constrain the central black hole mass to 4.15 ± 0.03 million solar masses and reveal an extended mass distribution of stellar remnants."
astro_068,"Analysis of gamma-ray observations from Fermi-LAT detects periodic modulation in the emission from the binary system LS I +61 303. The gamma-ray orbital light curve peaks at superior conjunction, consistent with inverse Compton scattering of stellar photons by relativistic electrons in the pulsar wind."
astro_069,"We investigate the origin of ultradiffuse galaxies in the Coma cluster using deep imaging and spectroscopy. The stellar populations indicate these galaxies are failed L-star systems that ceased star formation early due to ram pressure stripping upon cluster infall 8 billion years ago."
astro_070,"Microlensing observations toward the galactic bulge from OGLE and MOA surveys constrain the population of free-floating planets. The event timescale distribution implies approximately one Earth-mass unbound planet per main-sequence star in the galaxy, suggesting frequent planetary ejection."
astro_071,"We measure the luminosity function of Lyman-break galaxies at z = 9-10 using ultra-deep JWST imaging. The observed number density exceeds predictions from pre-JWST theoretical models by a factor of five, implying either more efficient star formation or reduced dust obscuration in early galaxies."
astro_072,"Radio observations of fast radio burst FRB 20201124A detect polarization angle swings correlated with burst morphology. The rotation measure variations on millisecond timescales require a magnetized plasma within 1 AU of the source, consistent with a magnetar in a binary system with a massive companion."
astro_073,"We analyze the dynamical evolution of the Saturnian ring system using N-body simulations including viscous spreading. The young apparent age of 100 million years derived from ring mass loss rates can be reconciled with ancient origin if recent cometary bombardment resurfaced the rings."
astro_074,"Spectroscopic analysis of horizontal branch stars in the globular cluster NGC 2808 reveals three distinct populations with different helium abundances. The helium spread of Delta Y = 0.13 requires multiple star formation episodes with material enriched by massive stellar winds in the first generation."
astro_075,"We present upper limits on continuous gravitational waves from the Crab pulsar using LIGO O3 data. The strain sensitivity of 10^-26 at 60 Hz constrains the neutron star ellipticity to below 10^-6, implying the pulsar's spindown is dominated by electromagnetic rather than gravitational wave emission."
astro_076,"Deep optical spectroscopy of damped Lyman-alpha absorbers at z = 2-3 measures deuterium abundances with 2% precision. The primordial deuterium-to-hydrogen ratio of (2.527 ± 0.030) × 10^-5 constrains the baryon density and provides a key test of Big Bang nucleosynthesis predictions."
astro_077,"We investigate the atmospheric dynamics of the hot Jupiter HD 189733b using phase-resolved emission spectroscopy. The observed eastward hot spot offset of 30 degrees longitude is reproduced by 3D climate models with drag timescales of 10^4 seconds in the photosphere."
astro_078,"Analysis of stellar oscillations in 80 solar-type stars from TESS constrains internal rotation profiles using rotational splitting of mixed modes. The core-to-envelope rotation ratio increases from unity on the main sequence to values exceeding 10 in subgiant stars, tracing angular momentum transport."
astro_079,"We report the discovery of an extended X-ray jet from the quasar 4C+19.44 at z = 0.72 using Chandra observations. The jet extends 150 kpc from the nucleus and shows increasing X-ray-to-radio ratio with distance, favoring inverse Compton scattering of CMB photons over synchrotron emission."
astro_080,"Numerical simulations of core-collapse supernovae in 3D reveal the critical role of neutrino-driven convection in shock revival. The development of the standing accretion shock instability 200 ms post-bounce initiates explosion for progenitor masses between 9 and 25 solar masses."
astro_081,"We constrain the primordial power spectrum using Lyman-alpha forest observations at z = 4-5. The measured small-scale matter power rules out warm dark matter particles with masses below 5 keV and constrains the running of the spectral index to dns/dlnk = -0.010 ± 0.008."
